{
  "schemaVersion": "0.1.0",
  "format": "knapm-index",
  "sessionId": "fixture-knapm-overlap-record",
  "operationId": "fixture-knapm-overlap-op",
  "chunks": [
    {
      "chunkSequence": 1,
      "batchSequence": 1,
      "file": "chunks/trace-000001.jsonl",
      "compression": "none",
      "eventCount": 1,
      "firstRecordSequence": 0,
      "lastRecordSequence": 0,
      "firstEventId": 1,
      "lastEventId": 1,
      "byteLength": 275,
      "sha256": "5faf6cad46b55100d8fcd3fa15ac77d90f9ee5bbf84e692f73031cfab50705ea"
    },
    {
      "chunkSequence": 2,
      "batchSequence": 2,
      "file": "chunks/trace-000002.jsonl",
      "compression": "none",
      "eventCount": 1,
      "firstRecordSequence": 0,
      "lastRecordSequence": 0,
      "firstEventId": 2,
      "lastEventId": 2,
      "byteLength": 261,
      "sha256": "d4da23b33e6210eb6c4a3b56f95fa71f05163849c02bb6831a07d7b4c9d79791"
    }
  ]
}
