{
  "schemaVersion": "0.1.0",
  "format": "knapm-index",
  "sessionId": "fixture-knapm-partial",
  "operationId": "fixture-knapm-partial-op",
  "chunks": [
    {
      "chunkSequence": 1,
      "batchSequence": 1,
      "file": "chunks/trace-000001.jsonl",
      "compression": "none",
      "eventCount": 1,
      "firstRecordSequence": 1,
      "lastRecordSequence": 1,
      "firstEventId": 1,
      "lastEventId": 1,
      "byteLength": 275,
      "sha256": "5faf6cad46b55100d8fcd3fa15ac77d90f9ee5bbf84e692f73031cfab50705ea"
    }
  ]
}
