{
  "schemaVersion": "0.1.0",
  "format": "knapm-index",
  "sessionId": "fixture-knapm-zstd-valid",
  "operationId": "fixture-knapm-zstd-valid-op",
  "chunks": [
    {
      "chunkSequence": 1,
      "batchSequence": 1,
      "file": "chunks/trace-000001.jsonl.zst",
      "compression": "zstd",
      "eventCount": 1,
      "firstRecordSequence": 1,
      "lastRecordSequence": 1,
      "firstEventId": 1,
      "lastEventId": 1,
      "byteLength": 287,
      "sha256": "b56d873f5493c44d12dbcd8fa580c0a550aebefa6c7b59a836bafaecba3980b4",
      "uncompressedByteLength": 275,
      "uncompressedSha256": "5faf6cad46b55100d8fcd3fa15ac77d90f9ee5bbf84e692f73031cfab50705ea"
    }
  ]
}
